{
  "backend": "plonky3",
  "deterministic_seed": 0,
  "expected_verifier": "p3_uni_stark_0.6.1",
  "input_generator": {
    "initial_a": 0,
    "initial_b": 1,
    "kind": "fibonacci"
  },
  "logical_rows": 1048576,
  "profile": "tinyzkp-p3-goldilocks-v1",
  "resource_policy": {
    "checkpoint_policy": "retain_on_failure",
    "max_resident_bytes": 2147483648,
    "max_scratch_bytes": 1000000000,
    "max_threads": 4,
    "mode": "scratch",
    "scratch_dir": "/var/lib/tinyzkp-bench/scratch/fibonacci-1m/tinyzkp-conventional-fixed-host-v1"
  },
  "schema_version": 1,
  "workload_id": "fibonacci"
}
