{
  "schema_version": 1,
  "workload_id": "fibonacci",
  "backend": "plonky3",
  "profile": "tinyzkp-p3-goldilocks-v1",
  "input_generator": {"kind": "fibonacci", "initial_a": 0, "initial_b": 1},
  "logical_rows": 1048576,
  "deterministic_seed": 0,
  "resource_policy": {
    "mode": "scratch",
    "max_resident_bytes": 2147483648,
    "max_scratch_bytes": 1000000000,
    "scratch_dir": "/var/lib/tinyzkp-bench/scratch/fibonacci-1m",
    "max_threads": 4,
    "checkpoint_policy": "retain_on_failure"
  },
  "expected_verifier": "p3_uni_stark_0.6.1"
}
