{
  "schema_version": 1,
  "workload_id": "poseidon2_goldilocks",
  "backend": "plonky3",
  "profile": "tinyzkp-p3-goldilocks-v1",
  "input_generator": {"kind": "poseidon2", "seed": 0},
  "logical_rows": 1048576,
  "deterministic_seed": 0,
  "resource_policy": {
    "mode": "scratch",
    "max_resident_bytes": 1073741824,
    "max_scratch_bytes": 536870912000,
    "scratch_dir": "/var/lib/tinyzkp-bench/scratch/poseidon2-1m",
    "max_threads": 8,
    "checkpoint_policy": "retain_on_failure"
  },
  "expected_verifier": "p3_uni_stark_0.6.1"
}
