{
  "schema_version": 1,
  "workload_id": "poseidon2_goldilocks",
  "backend": "plonky3",
  "profile": "tinyzkp-p3-goldilocks-v1",
  "input_generator": {"kind": "poseidon2", "seed": 0},
  "logical_rows": 8,
  "deterministic_seed": 0,
  "resource_policy": {
    "mode": "scratch",
    "max_resident_bytes": 134217728,
    "max_scratch_bytes": 1073741824,
    "scratch_dir": "/tmp/tinyzkp-kat-poseidon2-8",
    "max_threads": 1,
    "checkpoint_policy": "delete_on_success"
  },
  "expected_verifier": "p3_uni_stark_0.6.1"
}
